title,body,rating,review_date,reviewer_name,reviewer_email,product_id,product_handle,reply,picture_urls
Love the design!,The Durga Mata eyes design is enchanting and radiates positive energy. Love wearing this hoodie!,5,09/02/2023,Rashi,rashi********@gmail.com,7979595071737,divine-blessings-graphic-hoodie-for-men-and-women,,
Fashionably divine,I feel fashionable and connected to spirituality when wearing this hoodie. The quality is top-notch!,5,08/19/2023,Prateek,prateek*******@yahoo.com,7979595071737,divine-blessings-graphic-hoodie-for-men-and-women,,
Must-have for spiritual souls,The TORCC Divine Blessings Hoodie is a perfect blend of style and spirituality. A must-have for spiritual souls!,4,07/22/2023,Ahmed,ahmed*******@hotmail.com,7979595071737,divine-blessings-graphic-hoodie-for-men-and-women,,
Comfortable and stylish,"The hoodie is incredibly soft and keeps me warm. It looks stylish too, perfect for everyday wear!",5,06/18/2023,Sophia,sophia*******@gmail.com,7979595071737,divine-blessings-graphic-hoodie-for-men-and-women,,
Beautiful gift for loved ones,I gifted the TORCC Divine Blessings Hoodie to my sister and she loved it! It's a thoughtful gift for anyone seeking style and spirituality.,5,09/15/2023,Varun,varun********@gmail.com,7979595071737,divine-blessings-graphic-hoodie-for-men-and-women,,
Unique and eye-catching,The eyes of Durga Mata on the hoodie are so captivating. I receive compliments whenever I wear it!,5,07/08/2023,Lakshmi,lakshmi*******@yahoo.com,7979595071737,divine-blessings-graphic-hoodie-for-men-and-women,,
Cozy and trendy,"This hoodie is my go-to for chilly evenings. It's cozy, trendy, and represents my devotion perfectly!",5,06/03/2023,Nikhil,nikhil*******@gmail.com,7979595071737,divine-blessings-graphic-hoodie-for-men-and-women,,
Spirituality meets fashion,I love how this hoodie blends spirituality with fashion. It's a unique and meaningful addition to my wardrobe!,4,06/08/2023,Emma,emma*******@yahoo.com,7979595071737,divine-blessings-graphic-hoodie-for-men-and-women,,
Perfect for any weather,"No matter the weather, this hoodie keeps me comfortable and stylish. It's my go-to choice for all occasions!",5,07/01/2023,Rohan,rohan*******@gmail.com,7979595071737,divine-blessings-graphic-hoodie-for-men-and-women,,
Fantastic craftsmanship,The TORCC Divine Blessings Hoodie is beautifully crafted with attention to detail. The quality is exceptional!,4,09/25/2023,Sneha,sneha*******@hotmail.com,7979595071737,divine-blessings-graphic-hoodie-for-men-and-women,,
Symbol of grace,Wearing this hoodie makes me feel connected to divine grace. It's a symbol of spirituality and style.,5,07/18/2023,Aarav,aarav*******@gmail.com,7979595071737,divine-blessings-graphic-hoodie-for-men-and-women,,
Versatile and trendy,"I can wear this hoodie with jeans, leggings, or sneakers. It's versatile, trendy, and matches any outfit!",5,06/14/2023,Olivia,olivia*******@yahoo.com,7979595071737,divine-blessings-graphic-hoodie-for-men-and-women,,
A divine connection,The TORCC Divine Blessings Hoodie is more than just fashion. It's a divine connection that stands out in the crowd!,4,09/09/2023,Rajesh,rajesh*******@gmail.com,7979595071737,divine-blessings-graphic-hoodie-for-men-and-women,,
Comfortable and inspiring,This hoodie embraces me in comfort and inspires my spiritual journey. Highly recommend!,5,07/25/2023,Himanshi,himanshi*******@yahoo.com,7979595071737,divine-blessings-graphic-hoodie-for-men-and-women,,