title,body,rating,review_date,reviewer_name,reviewer_email,product_id,product_handle,reply,picture_urls
Love the quirky design,The quirky design on this t-shirt is so unique and fun!,5,07/01/2023,Neha S****,neha.s****@gmail.com,7912900362489,too-cool-for-this-planet-unisex-graphic-t-shirt-graphic-tees,,
Great quality and comfort,The buttery cotton material of this t-shirt feels amazing and it's so comfortable to wear!,5,06/25/2023,David C****,david.c****@yahoo.com,7912900362489,too-cool-for-this-planet-unisex-graphic-t-shirt-graphic-tees,,
Versatile and stylish,I love how I can dress this t-shirt up or down for any occasion. It's a must-have!,5,06/10/2023,Aarav J****,aarav.j****@hotmail.com,7912900362489,too-cool-for-this-planet-unisex-graphic-t-shirt-graphic-tees,,
Great fit and durability,The t-shirt fits me perfectly and it's really well-made. It can withstand regular wear and washing!,5,06/15/2023,Sophia T****,sophia.t****@gmail.com,7912900362489,too-cool-for-this-planet-unisex-graphic-t-shirt-graphic-tees,,
Super cute design!,I get so many compliments on the quirky design of this t-shirt. It's really eye-catching!,5,06/12/2023,Ella K****,ella.k****@yahoo.com,7912900362489,too-cool-for-this-planet-unisex-graphic-t-shirt-graphic-tees,,
Perfect for casual outings,This t-shirt is my go-to choice for casual outings. It's comfortable and adds a cool vibe to my look!,5,06/01/2023,Mohammed A****,mohammed.a****@gmail.com,7912900362489,too-cool-for-this-planet-unisex-graphic-t-shirt-graphic-tees,,
Love the color options,I appreciate the range of colors available for this t-shirt. It makes it easy to find the perfect one for my style!,5,06/05/2023,Anna G****,anna.g****@yahoo.com,7912900362489,too-cool-for-this-planet-unisex-graphic-t-shirt-graphic-tees,,
Unique and eye-catching,I love wearing this t-shirt because the quirky design makes it stand out from the crowd. It's a conversation starter!,5,06/08/2023,Veer S****,veer.s****@hotmail.com,7912900362489,too-cool-for-this-planet-unisex-graphic-t-shirt-graphic-tees,,
Great value for money,"Considering the quality and unique design, this t-shirt is definitely worth the price. I'm very satisfied with my purchase!",5,06/04/2023,Olivia W****,olivia.w****@gmail.com,7912900362489,too-cool-for-this-planet-unisex-graphic-t-shirt-graphic-tees,,
Perfect gift for a friend,I bought this t-shirt as a gift for my friend and he absolutely loved it! It's a great choice for anyone with a quirky sense of style.,5,06/07/2023,Advait M****,advait.m****@yahoo.com,7912900362489,too-cool-for-this-planet-unisex-graphic-t-shirt-graphic-tees,,
Comfortable and stylish,"This t-shirt not only looks great, but it's also very comfortable to wear. I highly recommend it!",5,06/02/2023,Ishaan C****,ishaan.c****@gmail.com,7912900362489,too-cool-for-this-planet-unisex-graphic-t-shirt-graphic-tees,,
Sturdy and long-lasting,I've had this t-shirt for a while now and it's holding up really well. The quality is top-notch!,5,06/18/2023,Emma P****,emma.p****@yahoo.com,7912900362489,too-cool-for-this-planet-unisex-graphic-t-shirt-graphic-tees,,
Unique and fun design,I love how this t-shirt adds a playful and quirky touch to any outfit. It's a statement piece!,5,06/14/2023,Rajat S****,rajat.s****@gmail.com,7912900362489,too-cool-for-this-planet-unisex-graphic-t-shirt-graphic-tees,,
Great fit for everyone,I love that this t-shirt is unisex and comes in a range of sizes. It's inclusive and fits perfectly!,5,06/09/2023,Liam M****,liam.m****@yahoo.com,7912900362489,too-cool-for-this-planet-unisex-graphic-t-shirt-graphic-tees,,
Highly recommended,"If you're looking for a cool and unique t-shirt, this is definitely the one to get. It exceeded my expectations!",5,06/03/2023,Harpreet K****,harpreet.k****@gmail.com,7912900362489,too-cool-for-this-planet-unisex-graphic-t-shirt-graphic-tees,,
Fantastic design and quality,I'm so impressed with the design and quality of this t-shirt. It's a standout piece in my wardrobe!,5,06/11/2023,Hannah B****,hannah.b****@yahoo.com,7912900362489,too-cool-for-this-planet-unisex-graphic-t-shirt-graphic-tees,,