title,body,rating,review_date,reviewer_name,reviewer_email,product_id,product_handle,reply,picture_urls
Great protection!,Love how durable this case is. It keeps my phone safe from any impact.,5,06/15/2023,Aarav Sharma,aarav***@gmail.com,7975628570873,tough-case-for-iphone®,,
Stylish and practical!,"Not only does this case protect my phone, but it also looks great. I love the dual-layer design!",5,06/20/2023,Sophia Kim,sophia***@hotmail.com,7975628570873,tough-case-for-iphone®,,
Excellent quality,The materials used in this case are top-notch. It feels sturdy and durable.,5,07/05/2023,Ravi Patel,ravi***@yahoo.com,7975628570873,tough-case-for-iphone®,,
Best case ever!,This is the best case I have ever used. It provides great protection without compromising on style.,5,07/15/2023,Emily Thompson,emily***@gmail.com,7975628570873,tough-case-for-iphone®,,
Great value for money,"Considering the quality and protection it offers, this case is definitely worth the price.",5,07/30/2023,Aditya Joshi,aditya***@outlook.com,7975628570873,tough-case-for-iphone®,,
Love the design,The port openings are perfectly aligned and the case looks sleek. Great job!,5,08/05/2023,Lily Chen,lily***@gmail.com,7975628570873,tough-case-for-iphone®,,
Impressive protection,This case has saved my phone from multiple drops. It's an absolute life-saver!,5,08/15/2023,Ankit Singh,ankit***@yahoo.com,7975628570873,tough-case-for-iphone®,,
Fits perfectly,The case fits my iPhone perfectly and doesn't add much bulk to it. Highly recommended!,5,08/25/2023,Grace Lee,grace***@hotmail.com,7975628570873,tough-case-for-iphone®,,
Durable and stylish,I love the combination of durability and style this case offers. It's exactly what I was looking for.,5,09/10/2023,Vikram Sharma,vikram***@gmail.com,7975628570873,tough-case-for-iphone®,,
Great purchase,I'm very happy with my purchase. The case arrived in perfect condition and provides excellent protection.,5,09/20/2023,Olivia Wilson,olivia***@yahoo.com,7975628570873,tough-case-for-iphone®,,
Perfect fit,The case fits like a glove and doesn't interfere with any of the phone's functions. Highly recommended!,5,10/05/2023,Aashi Trivedi,aashi***@gmail.com,7975628570873,tough-case-for-iphone®,,
Excellent customer service,I had an issue with my order and the customer service was quick to resolve it. Very impressed!,5,10/15/2023,Adam Smith,adam***@hotmail.com,7975628570873,tough-case-for-iphone®,,
Well-made case,The case feels solid and well-made. It gives me peace of mind knowing my phone is protected.,5,10/25/2023,Isabella Rossi,isabella***@yahoo.com,7975628570873,tough-case-for-iphone®,,
Sturdy and reliable,I've dropped my phone multiple times with this case on and it has survived every time. Highly recommend!,5,10/30/2023,Arjun Mehta,arjun***@gmail.com,7975628570873,tough-case-for-iphone®,,
Great T-shirt!,I love the quirky design and the comfortable fabric.,5,06/05/2023,Nikita *,nikita*@gmail.com,7908948607225,use-your-brain-unisex-graphic-t-shirt-graphic-tees,,
Awesome design!,The unique graphic on this tee is eye-catching and fun.,4,06/10/2023,Ravi *,ravi*@yahoo.com,7908948607225,use-your-brain-unisex-graphic-t-shirt-graphic-tees,,
Perfect fit!,"The size chart was accurate, and the shirt fits me perfectly.",5,06/15/2023,Maria *,maria*@gmail.com,7908948607225,use-your-brain-unisex-graphic-t-shirt-graphic-tees,,
Love the colors!,The range of colors available for this tee is impressive.,5,06/20/2023,Rahul *,rahul*@gmail.com,7908948607225,use-your-brain-unisex-graphic-t-shirt-graphic-tees,,
Comfortable and stylish,This tee is perfect for both casual and dressy occasions.,4,06/25/2023,Isabella *,isabella*@hotmail.com,7908948607225,use-your-brain-unisex-graphic-t-shirt-graphic-tees,,
High-quality fabric,The cotton used for this tee is soft and durable.,5,07/01/2023,Siddharth *,siddharth*@gmail.com,7908948607225,use-your-brain-unisex-graphic-t-shirt-graphic-tees,,
Unique design,I haven't seen anything like this tee before. Love it!,4,07/05/2023,Emma *,emma*@yahoo.com,7908948607225,use-your-brain-unisex-graphic-t-shirt-graphic-tees,,
Great gift idea,Bought this tee for my friend and he absolutely loves it!,5,07/10/2023,Prakash *,prakash*@gmail.com,7908948607225,use-your-brain-unisex-graphic-t-shirt-graphic-tees,,
Perfect for summer,"The fabric is lightweight and breathable, ideal for hot days.",4,07/15/2023,Olivia *,olivia*@gmail.com,7908948607225,use-your-brain-unisex-graphic-t-shirt-graphic-tees,,
Great value for money,"Considering the quality and design, this tee is reasonably priced.",5,07/20/2023,Amit *,amit*@rediffmail.com,7908948607225,use-your-brain-unisex-graphic-t-shirt-graphic-tees,,