product_handle,status,content,rating,photo_url,name,country,email,created_at,product_id
author-oversized-t-shirt-for-men-and-women,,Absolutely love the design and quality of this t-shirt! The oversized fit is perfect for a casual day out. Will definitely be ordering more.,5,,Priya Singh,India,priya*****@gmail.com,2023-12-15
author-oversized-t-shirt-for-men-and-women,,"The print is so eye-catching and the material is so comfortable. Received many compliments when I wore it. Great job, team!",4,,Rohan Gupta,India,rohan****@yahoo.com,2023-12-28
author-oversized-t-shirt-for-men-and-women,,Ordered this t-shirt for my partner and they love it! The print is vibrant and the fabric is top-notch quality. Highly recommend.,5,,Neha Sharma,India,neha*****@outlook.com,2024-01-08
author-oversized-t-shirt-for-men-and-women,,The oversized fit is so trendy and cool. The fabric feels luxurious and the print is unique. Will be buying more in different designs.,5,,Aryan Kapoor,India,aryan****@gmail.com,2024-01-20
author-oversized-t-shirt-for-men-and-women,,This t-shirt exceeded my expectations. The fit is just as described and the fabric is super soft. Definitely worth the purchase!,5,,Ananya Patel,India,ananya****@hotmail.com,2024-02-05
author-oversized-t-shirt-for-men-and-women,,The print on this t-shirt is so artistic and unique. It's a great conversation starter and the quality is impressive. Very happy with my purchase.,4,,Vivek Khanna,India,vivek****@gmail.com,2024-02-18
author-oversized-t-shirt-for-men-and-women,,Bought this t-shirt for myself and it fits perfectly oversized. The fabric is breathable and the print hasn't faded after washes. Great product!,5,,Ishaan Kumar,India,ishaan****@yahoo.com,2024-03-03
author-oversized-t-shirt-for-men-and-women,,The design on this t-shirt is so aesthetic and the material is top-notch. It's my new favorite go-to t-shirt for a chill day out.,4,,Sneha Reddy,India,sneha****@outlook.com,2024-03-15